{
  "adjudication_sha256": "5f27ff7fe47d9fe3b41d71e1d85c96c1b4536ea3bb93429b94bfb823ae34504f",
  "corpus_sha256": "8cc18cb3aad82b634af12367a5e560ef45f35ce0aa0fcebdbf84cbdc9a8e033a",
  "histories": [
    {
      "active_characters": null,
      "authority_violations": null,
      "exact_expected": 1,
      "exact_matched": null,
      "expected_label_count": 2,
      "failure_code": "not-evaluated-contract-fixture",
      "history_id": "fixture-public-api",
      "matched_label_count": null,
      "observed_label_count": null,
      "outcome": "failed",
      "protected_expected": 2,
      "protected_matched": null,
      "provenance_errors": null,
      "source_characters": 76,
      "split": "train",
      "stale_claims": null,
      "unresolved_to_fact": null
    },
    {
      "active_characters": null,
      "authority_violations": null,
      "exact_expected": 0,
      "exact_matched": null,
      "expected_label_count": 2,
      "failure_code": "not-evaluated-contract-fixture",
      "history_id": "fixture-consented-cache",
      "matched_label_count": null,
      "observed_label_count": null,
      "outcome": "failed",
      "protected_expected": 2,
      "protected_matched": null,
      "provenance_errors": null,
      "source_characters": 103,
      "split": "development",
      "stale_claims": null,
      "unresolved_to_fact": null
    },
    {
      "active_characters": null,
      "authority_violations": null,
      "exact_expected": 1,
      "exact_matched": null,
      "expected_label_count": 2,
      "failure_code": "not-evaluated-contract-fixture",
      "history_id": "fixture-synthetic-release",
      "matched_label_count": null,
      "observed_label_count": null,
      "outcome": "failed",
      "protected_expected": 2,
      "protected_matched": null,
      "provenance_errors": null,
      "source_characters": 86,
      "split": "test",
      "stale_claims": null,
      "unresolved_to_fact": null
    }
  ],
  "report_sha256": "70ef15e9a954693dc4b62e19161bd6f02d7fe5a4e966dfe98b4a9ac5e235b29d",
  "run": {
    "claim_scope": "diagnostic-only",
    "finished_at_utc": "2026-07-24T22:31:00Z",
    "run_id": "contract-fixture-no-run",
    "semantic_completeness_claimed": false,
    "started_at_utc": "2026-07-24T22:30:00Z",
    "system_id": "contract-fixture-no-system",
    "system_revision": "4444444444444444444444444444444444444444444444444444444444444444",
    "tokenizer_id": "not-evaluated"
  },
  "schema": "ctxc-natural-history-report-0.1",
  "split_sha256": "7d39c5989a1a85607f3cb175ae9b7f56bc7d1271739d9bd127ca9376c5fd3c1c",
  "summary": {
    "all_histories_retained": true,
    "claim_ready": false,
    "complete_without_failures": false,
    "exact_expected": 2,
    "exact_matched": 0,
    "expected_label_count": 6,
    "failed_history_count": 3,
    "history_count": 3,
    "matched_label_count": 0,
    "natural_history_claimed": false,
    "protected_expected": 6,
    "protected_matched": 0,
    "scored_history_count": 0,
    "semantic_completeness_claimed": false
  }
}
